{
  "format_version": "1.0.0",
  "site": {
    "name": "W1 plan",
    "coordinate_system": "local station",
    "units": "feet",
    "road_name": "Example Road",
    "state": "OR"
  },
  "typical_application": {
    "type": "lane_closure",
    "direction": "NB",
    "posted_speed_mph": 45,
    "lanes_total": 2,
    "lanes_closed": 1
  },
  "zones": [
    {
      "zone_id": "Z-aw",
      "type": "advance_warning",
      "start_station": 0,
      "end_station": 500
    },
    {
      "zone_id": "Z-tr",
      "type": "transition",
      "start_station": 500,
      "end_station": 1000
    },
    {
      "zone_id": "Z-work",
      "type": "work",
      "start_station": 1000,
      "end_station": 2000
    },
    {
      "zone_id": "Z-term",
      "type": "termination",
      "start_station": 2000,
      "end_station": 2200
    }
  ],
  "elements": [
    {
      "element_id": "T-sh",
      "type": "taper",
      "taper_type": "shoulder",
      "start_station": 400,
      "end_station": 450,
      "start_offset": 0,
      "end_offset": 12,
      "zone_id": "Z-tr"
    },
    {
      "element_id": "T-dn",
      "type": "taper",
      "taper_type": "downstream",
      "start_station": 2000,
      "end_station": 2150,
      "start_offset": 12,
      "end_offset": 0,
      "zone_id": "Z-term"
    }
  ]
}
